{
  "_schema_version": 1,
  "id": "tokens/color-text-tokens",
  "title": "Color — Text Tokens",
  "path": [
    "tokens",
    "color-text-tokens"
  ],
  "parent": "tokens",
  "anchors": {
    "h2": "tokens",
    "h3": "color-text-tokens"
  },
  "source": {
    "file": "foundations/src/foundations.md",
    "startLine": 625,
    "endLine": 642
  },
  "_meta": {
    "auto_generated": true,
    "source": "foundations/src/foundations.md",
    "do_not_edit": "Edit the source MD; CI regenerates this file."
  },
  "blocks": [
    {
      "type": "table",
      "headers": [
        "Token",
        "Resolves To",
        "Usage",
        "Status"
      ],
      "rows": [
        {
          "Token": "--zen-color-text-primary",
          "Resolves To": "--zen-color-black",
          "Usage": "Titles, labels, body text",
          "status_note": "Shipped",
          "status": "shipped"
        },
        {
          "Token": "--zen-color-text-secondary",
          "Resolves To": "--zen-color-grey-800",
          "Usage": "Hints, subtext",
          "status_note": "Shipped",
          "status": "shipped"
        },
        {
          "Token": "--zen-color-text-tertiary",
          "Resolves To": "--zen-color-grey-700",
          "Usage": "Subtitles, alternate texts",
          "status_note": "Shipped",
          "status": "shipped"
        },
        {
          "Token": "--zen-color-text-placeholder",
          "Resolves To": "--zen-color-grey-600",
          "Usage": "Input placeholders",
          "status_note": "Shipped",
          "status": "shipped"
        },
        {
          "Token": "--zen-color-text-placeholder-subtle",
          "Resolves To": "--zen-color-grey-400",
          "Usage": "Secondary placeholders (e.g. search fields)",
          "status_note": "Shipped",
          "status": "shipped"
        },
        {
          "Token": "--zen-color-text-disabled",
          "Resolves To": "--zen-color-grey-500",
          "Usage": "Disabled inputs, buttons, form elements",
          "status_note": "Shipped",
          "status": "shipped"
        },
        {
          "Token": "--zen-color-text-error",
          "Resolves To": "--zen-color-error-600",
          "Usage": "Error messages",
          "status_note": "Shipped",
          "status": "shipped"
        },
        {
          "Token": "--zen-color-text-warning",
          "Resolves To": "--zen-color-warning-600",
          "Usage": "Warning messages",
          "status_note": "Shipped",
          "status": "shipped"
        },
        {
          "Token": "--zen-color-text-success",
          "Resolves To": "--zen-color-success-600",
          "Usage": "Success messages",
          "status_note": "Shipped",
          "status": "shipped"
        },
        {
          "Token": "--zen-color-text-reverse",
          "Resolves To": "--zen-color-white",
          "Usage": "Text on dark or primary-colored backgrounds",
          "status_note": "Proposed",
          "status": "proposed"
        },
        {
          "Token": "--zen-color-text-link-default",
          "Resolves To": "--zen-color-primary-500",
          "Usage": "Default link color",
          "status_note": "Proposed",
          "status": "proposed"
        },
        {
          "Token": "--zen-color-text-link-visited",
          "Resolves To": "--zen-color-primary-700",
          "Usage": "Visited link color",
          "status_note": "Proposed",
          "status": "proposed"
        },
        {
          "Token": "--zen-color-text-link-reverse",
          "Resolves To": "--zen-color-white",
          "Usage": "Links on dark or primary-colored backgrounds",
          "status_note": "Proposed",
          "status": "proposed"
        }
      ]
    }
  ]
}
