{
  "_schema_version": 1,
  "id": "tokens/size-tokens/icon-sizes",
  "title": "Icon Sizes",
  "path": [
    "tokens",
    "size-tokens",
    "icon-sizes"
  ],
  "parent": "tokens/size-tokens",
  "anchors": {
    "h2": "tokens",
    "h3": "size-tokens",
    "h4": "icon-sizes"
  },
  "source": {
    "file": "foundations/src/foundations.md",
    "startLine": 991,
    "endLine": 999
  },
  "_meta": {
    "auto_generated": true,
    "source": "foundations/src/foundations.md",
    "do_not_edit": "Edit the source MD; CI regenerates this file."
  },
  "blocks": [
    {
      "type": "table",
      "headers": [
        "Token",
        "Value",
        "Usage",
        "Status"
      ],
      "rows": [
        {
          "Token": "--zen-icon-size-xs",
          "Value": "12px",
          "Usage": "Tight UI contexts, dense tables, badges",
          "status_note": "Proposed",
          "status": "proposed"
        },
        {
          "Token": "--zen-icon-size-sm",
          "Value": "16px",
          "Usage": "Inline icons, compact components",
          "status_note": "Proposed",
          "status": "proposed"
        },
        {
          "Token": "--zen-icon-size-md",
          "Value": "20px",
          "Usage": "Default icon size",
          "status_note": "Proposed",
          "status": "proposed"
        },
        {
          "Token": "--zen-icon-size-lg",
          "Value": "24px",
          "Usage": "Standalone icons, feature icons",
          "status_note": "Proposed",
          "status": "proposed"
        }
      ]
    }
  ]
}
