{
  "_schema_version": 1,
  "id": "tokens/border-tokens/style-composite",
  "title": "Style (Composite)",
  "path": [
    "tokens",
    "border-tokens",
    "style-composite"
  ],
  "parent": "tokens/border-tokens",
  "anchors": {
    "h2": "tokens",
    "h3": "border-tokens",
    "h4": "style-composite"
  },
  "source": {
    "file": "foundations/src/foundations.md",
    "startLine": 664,
    "endLine": 673
  },
  "_meta": {
    "auto_generated": true,
    "source": "foundations/src/foundations.md",
    "do_not_edit": "Edit the source MD; CI regenerates this file."
  },
  "blocks": [
    {
      "type": "table",
      "headers": [
        "Token",
        "Value",
        "Usage",
        "Status"
      ],
      "rows": [
        {
          "Token": "--zen-border-default",
          "Value": "1px solid grey-100",
          "Usage": "Default border for containers",
          "status_note": "Shipped",
          "status": "shipped"
        },
        {
          "Token": "--zen-border-subtle",
          "Value": "1px solid grey-50",
          "Usage": "Separators",
          "status_note": "Shipped",
          "status": "shipped"
        },
        {
          "Token": "--zen-border-disabled",
          "Value": "1px solid grey-100",
          "Usage": "Disabled state of components",
          "status_note": "Shipped",
          "status": "shipped"
        },
        {
          "Token": "--zen-border-selected",
          "Value": "2px solid --zen-color-primary-500",
          "Usage": "Selected state of components",
          "status_note": "Proposed",
          "status": "proposed"
        },
        {
          "Token": "--zen-border-error",
          "Value": "1px solid --zen-color-error-500",
          "Usage": "Error state inputs",
          "status_note": "Shipped",
          "status": "shipped"
        }
      ]
    }
  ]
}
