{
  "_schema_version": 1,
  "id": "design-guidelines/typography-rules",
  "title": "Typography Rules",
  "path": [
    "design-guidelines",
    "typography-rules"
  ],
  "parent": "design-guidelines",
  "anchors": {
    "h2": "design-guidelines",
    "h3": "typography-rules"
  },
  "source": {
    "file": "foundations/src/",
    "startLine": 1001,
    "endLine": 1046
  },
  "children": [
    {
      "id": "design-guidelines/typography-rules/typeface",
      "title": "Typeface",
      "order": 1
    },
    {
      "id": "design-guidelines/typography-rules/language-support",
      "title": "Language Support",
      "order": 2
    },
    {
      "id": "design-guidelines/typography-rules/minimum-size",
      "title": "Minimum Size",
      "order": 3
    },
    {
      "id": "design-guidelines/typography-rules/line-length",
      "title": "Line Length",
      "order": 4
    },
    {
      "id": "design-guidelines/typography-rules/paragraph-spacing",
      "title": "Paragraph Spacing",
      "order": 5
    },
    {
      "id": "design-guidelines/typography-rules/accessibility",
      "title": "Accessibility",
      "order": 6
    }
  ],
  "_meta": {
    "auto_generated": true,
    "source": "foundations/src/",
    "do_not_edit": "Edit the per-section src/ files; CI regenerates this file."
  }
}
