{
  "_schema_version": 1,
  "id": "color-primitives-themes/primitives/dropped-brick-red",
  "title": "Dropped Brick Red",
  "path": [
    "color-primitives-themes",
    "primitives",
    "dropped-brick-red"
  ],
  "parent": "color-primitives-themes/primitives",
  "anchors": {
    "h2": "color-primitives-themes",
    "h3": "primitives",
    "h4": "dropped-brick-red"
  },
  "source": {
    "file": "foundations/src/foundations.md",
    "startLine": 455,
    "endLine": 472
  },
  "_meta": {
    "auto_generated": true,
    "source": "foundations/src/foundations.md",
    "do_not_edit": "Edit the source MD; CI regenerates this file."
  },
  "body": "OKLCH 500 base: oklch(0.5292 0.1745 37.67)",
  "blocks": [
    {
      "type": "table",
      "headers": [
        "Shade",
        "Token",
        "Hex (Figma)",
        "OKLCH (Eng)"
      ],
      "rows": [
        {
          "Shade": "25",
          "Token": "--zen-color-dropped-brick-red-25",
          "Hex (Figma)": "#FFF6EC",
          "OKLCH (Eng)": "oklch(0.99 0.0349 37.67)"
        },
        {
          "Shade": "50",
          "Token": "--zen-color-dropped-brick-red-50",
          "Hex (Figma)": "#FFD7CA",
          "OKLCH (Eng)": "oklch(0.9178 0.0524 37.67)"
        },
        {
          "Shade": "100",
          "Token": "--zen-color-dropped-brick-red-100",
          "Hex (Figma)": "#F3BBA9",
          "OKLCH (Eng)": "oklch(0.8617 0.0698 37.67)"
        },
        {
          "Shade": "200",
          "Token": "--zen-color-dropped-brick-red-200",
          "Hex (Figma)": "#EB9980",
          "OKLCH (Eng)": "oklch(0.7877 0.1047 37.67)"
        },
        {
          "Shade": "300",
          "Token": "--zen-color-dropped-brick-red-300",
          "Hex (Figma)": "#DA7C61",
          "OKLCH (Eng)": "oklch(0.7296 0.1222 37.67)"
        },
        {
          "Shade": "400",
          "Token": "--zen-color-dropped-brick-red-400",
          "Hex (Figma)": "#CB5D3B",
          "OKLCH (Eng)": "oklch(0.6450 0.1483 37.67)"
        },
        {
          "Shade": "**500**",
          "Token": "**`--zen-color-dropped-brick-red-500`**",
          "Hex (Figma)": "**`#BA3800`**",
          "OKLCH (Eng)": "**`oklch(0.5292 0.1745 37.67)`**"
        },
        {
          "Shade": "600",
          "Token": "--zen-color-dropped-brick-red-600",
          "Hex (Figma)": "#B22700",
          "OKLCH (Eng)": "oklch(0.4974 0.1832 37.67)"
        },
        {
          "Shade": "700",
          "Token": "--zen-color-dropped-brick-red-700",
          "Hex (Figma)": "#9C2000",
          "OKLCH (Eng)": "oklch(0.4498 0.1658 37.67)"
        },
        {
          "Shade": "800",
          "Token": "--zen-color-dropped-brick-red-800",
          "Hex (Figma)": "#7B2000",
          "OKLCH (Eng)": "oklch(0.3863 0.1309 37.67)"
        },
        {
          "Shade": "900",
          "Token": "--zen-color-dropped-brick-red-900",
          "Hex (Figma)": "#5D1F0B",
          "OKLCH (Eng)": "oklch(0.3334 0.0960 37.67)"
        }
      ]
    }
  ]
}
