{
  "_schema_version": 1,
  "id": "tokens/color-global-tokens",
  "title": "Color — Global Tokens",
  "path": [
    "tokens",
    "color-global-tokens"
  ],
  "parent": "tokens",
  "anchors": {
    "h2": "tokens",
    "h3": "color-global-tokens"
  },
  "source": {
    "file": "foundations/src/foundations.md",
    "startLine": 603,
    "endLine": 624
  },
  "children": [
    {
      "id": "tokens/color-global-tokens/white-black",
      "title": "White & Black",
      "order": 1
    },
    {
      "id": "tokens/color-global-tokens/semantic-aliases",
      "title": "Semantic Aliases",
      "order": 2
    }
  ],
  "_meta": {
    "auto_generated": true,
    "source": "foundations/src/foundations.md",
    "do_not_edit": "Edit the source MD; CI regenerates this file."
  }
}
