{
  "_schema_version": 1,
  "id": "color-primitives-themes/primitives/kickstart-purple",
  "title": "Kickstart Purple",
  "path": [
    "color-primitives-themes",
    "primitives",
    "kickstart-purple"
  ],
  "parent": "color-primitives-themes/primitives",
  "anchors": {
    "h2": "color-primitives-themes",
    "h3": "primitives",
    "h4": "kickstart-purple"
  },
  "source": {
    "file": "foundations/src/foundations.md",
    "startLine": 347,
    "endLine": 364
  },
  "_meta": {
    "auto_generated": true,
    "source": "foundations/src/foundations.md",
    "do_not_edit": "Edit the source MD; CI regenerates this file."
  },
  "body": "OKLCH 500 base: oklch(0.6113 0.1162 278.98)",
  "blocks": [
    {
      "type": "table",
      "headers": [
        "Shade",
        "Token",
        "Hex (Figma)",
        "OKLCH (Eng)"
      ],
      "rows": [
        {
          "Shade": "25",
          "Token": "--zen-color-kickstart-purple-25",
          "Hex (Figma)": "#F9FBFF",
          "OKLCH (Eng)": "oklch(0.99 0.0232 278.98)"
        },
        {
          "Shade": "50",
          "Token": "--zen-color-kickstart-purple-50",
          "Hex (Figma)": "#E1E5FF",
          "OKLCH (Eng)": "oklch(0.9295 0.0349 278.98)"
        },
        {
          "Shade": "100",
          "Token": "--zen-color-kickstart-purple-100",
          "Hex (Figma)": "#CBD0F2",
          "OKLCH (Eng)": "oklch(0.8776 0.0465 278.98)"
        },
        {
          "Shade": "200",
          "Token": "--zen-color-kickstart-purple-200",
          "Hex (Figma)": "#B4BAEB",
          "OKLCH (Eng)": "oklch(0.7973 0.0697 278.98)"
        },
        {
          "Shade": "300",
          "Token": "--zen-color-kickstart-purple-300",
          "Hex (Figma)": "#9FA5DD",
          "OKLCH (Eng)": "oklch(0.7354 0.0813 278.98)"
        },
        {
          "Shade": "400",
          "Token": "--zen-color-kickstart-purple-400",
          "Hex (Figma)": "#8A90D3",
          "OKLCH (Eng)": "oklch(0.6734 0.0988 278.98)"
        },
        {
          "Shade": "**500**",
          "Token": "**`--zen-color-kickstart-purple-500`**",
          "Hex (Figma)": "**`#757BC8`**",
          "OKLCH (Eng)": "**`oklch(0.6113 0.1162 278.98)`**"
        },
        {
          "Shade": "600",
          "Token": "--zen-color-kickstart-purple-600",
          "Hex (Figma)": "#6A6FBF",
          "OKLCH (Eng)": "oklch(0.5746 0.122 278.98)"
        },
        {
          "Shade": "700",
          "Token": "--zen-color-kickstart-purple-700",
          "Hex (Figma)": "#5C61A7",
          "OKLCH (Eng)": "oklch(0.5196 0.1104 278.98)"
        },
        {
          "Shade": "800",
          "Token": "--zen-color-kickstart-purple-800",
          "Hex (Figma)": "#4A4E84",
          "OKLCH (Eng)": "oklch(0.4463 0.0872 278.98)"
        },
        {
          "Shade": "900",
          "Token": "--zen-color-kickstart-purple-900",
          "Hex (Figma)": "#3C4066",
          "OKLCH (Eng)": "oklch(0.3851 0.0639 278.98)"
        }
      ]
    }
  ]
}
