{
  "_schema_version": 1,
  "id": "design-guidelines/typography-rules/minimum-size",
  "title": "Minimum Size",
  "path": [
    "design-guidelines",
    "typography-rules",
    "minimum-size"
  ],
  "parent": "design-guidelines/typography-rules",
  "anchors": {
    "h2": "design-guidelines",
    "h3": "typography-rules",
    "h4": "minimum-size"
  },
  "source": {
    "file": "foundations/src/",
    "startLine": 1013,
    "endLine": 1017
  },
  "_meta": {
    "auto_generated": true,
    "source": "foundations/src/",
    "do_not_edit": "Edit the per-section src/ files; CI regenerates this file."
  },
  "body": "Must not use type sizes smaller than 11px. You may use 11px text in labels, tags, data visualizations, and supporting text with icon."
}
