{
  "_schema_version": 1,
  "id": "component-specs",
  "title": "Component Specs",
  "path": [
    "component-specs"
  ],
  "parent": "",
  "anchors": {
    "h2": "component-specs"
  },
  "source": {
    "file": "foundations/src/foundations.md",
    "startLine": 1086,
    "endLine": 1126
  },
  "children": [
    {
      "id": "component-specs/focus-ring-rules",
      "title": "Focus Ring Rules",
      "order": 1
    },
    {
      "id": "component-specs/border-usage",
      "title": "Border Usage",
      "order": 2
    },
    {
      "id": "component-specs/placeholder-text",
      "title": "Placeholder Text",
      "order": 3
    }
  ],
  "_meta": {
    "auto_generated": true,
    "source": "foundations/src/foundations.md",
    "do_not_edit": "Edit the source MD; CI regenerates this file."
  },
  "body": "> This section will grow as components are documented. Each component entry should include: anatomy, states, behavior rules, and do/don&#39;t guidance."
}
