{
  "_schema_version": 1,
  "id": "tokens/icon-color-tokens",
  "title": "Icon Color Tokens",
  "path": [
    "tokens",
    "icon-color-tokens"
  ],
  "parent": "tokens",
  "anchors": {
    "h2": "tokens",
    "h3": "icon-color-tokens"
  },
  "source": {
    "file": "foundations/src/foundations.md",
    "startLine": 1000,
    "endLine": 1015
  },
  "_meta": {
    "auto_generated": true,
    "source": "foundations/src/foundations.md",
    "do_not_edit": "Edit the source MD; CI regenerates this file."
  },
  "blocks": [
    {
      "type": "table",
      "headers": [
        "Token",
        "Suggested Value",
        "Usage",
        "Status"
      ],
      "rows": [
        {
          "Token": "--zen-color-icon-default",
          "Suggested Value": "--zen-color-black",
          "Usage": "Default icon color",
          "status_note": "Proposed",
          "status": "proposed"
        },
        {
          "Token": "--zen-color-icon-subtle",
          "Suggested Value": "--zen-color-neutral-600",
          "Usage": "De-emphasized icons",
          "status_note": "Proposed",
          "status": "proposed"
        },
        {
          "Token": "--zen-color-icon-disabled",
          "Suggested Value": "--zen-color-neutral-400",
          "Usage": "Disabled icon state (no filter — uses explicit color)",
          "status_note": "Proposed",
          "status": "proposed"
        },
        {
          "Token": "--zen-color-icon-primary",
          "Suggested Value": "--zen-color-primary-600",
          "Usage": "Primary action icons",
          "status_note": "Proposed",
          "status": "proposed"
        },
        {
          "Token": "--zen-color-icon-error",
          "Suggested Value": "--zen-color-error-600",
          "Usage": "Error state icons",
          "status_note": "Proposed",
          "status": "proposed"
        },
        {
          "Token": "--zen-color-icon-success",
          "Suggested Value": "--zen-color-success-600",
          "Usage": "Success state icons",
          "status_note": "Proposed",
          "status": "proposed"
        },
        {
          "Token": "--zen-color-icon-warning",
          "Suggested Value": "--zen-color-warning-600",
          "Usage": "Warning state icons",
          "status_note": "Proposed",
          "status": "proposed"
        },
        {
          "Token": "--zen-color-icon-reverse",
          "Suggested Value": "--zen-color-white",
          "Usage": "Icons on dark or primary-colored backgrounds",
          "status_note": "Proposed",
          "status": "proposed"
        }
      ]
    }
  ]
}
