{
  "_schema_version": 1,
  "id": "foundations/breakpoints",
  "title": "Breakpoints",
  "path": [
    "foundations",
    "breakpoints"
  ],
  "parent": "foundations",
  "anchors": {
    "h2": "foundations",
    "h3": "breakpoints"
  },
  "source": {
    "file": "foundations/src/foundations.md",
    "startLine": 1078,
    "endLine": 1085
  },
  "_meta": {
    "auto_generated": true,
    "source": "foundations/src/foundations.md",
    "do_not_edit": "Edit the source MD; CI regenerates this file."
  },
  "body": "Design mobile-first. Breakpoints define where layouts expand, not where they collapse. The four breakpoints cover phone landscape (sm), tablet (md), desktop (lg), and large screens (xl)."
}
