{
  "_schema_version": 1,
  "id": "design-guidelines/spacing-rules",
  "title": "Spacing Rules",
  "path": [
    "design-guidelines",
    "spacing-rules"
  ],
  "parent": "design-guidelines",
  "anchors": {
    "h2": "design-guidelines",
    "h3": "spacing-rules"
  },
  "source": {
    "file": "foundations/src/",
    "startLine": 1047,
    "endLine": 1060
  },
  "_meta": {
    "auto_generated": true,
    "source": "foundations/src/",
    "do_not_edit": "Edit the per-section src/ files; CI regenerates this file."
  },
  "body": "Use spacing tokens for all margin, padding, and gap values. The scale is:\n\nNever use arbitrary pixel values for spacing. If a layout needs something outside the scale, it&#39;s a signal to propose a new token.",
  "blocks": [
    {
      "type": "list",
      "ordered": false,
      "items": [
        "2xs–xs for internal element spacing (icon-to-label, checkbox-to-text)",
        "sm–md for internal component padding",
        "lg–xl for spacing between sections and groups",
        "2xl–3xl for page-level layout breathing room"
      ]
    }
  ]
}
