{
  "_schema_version": 1,
  "id": "tokens/global-color",
  "title": "Global Color",
  "path": [
    "tokens",
    "global-color"
  ],
  "parent": "tokens",
  "anchors": {
    "h2": "tokens",
    "h3": "global-color"
  },
  "source": {
    "file": "foundations/src/",
    "startLine": 580,
    "endLine": 589
  },
  "_meta": {
    "auto_generated": true,
    "source": "foundations/src/",
    "do_not_edit": "Edit the per-section src/ files; CI regenerates this file."
  },
  "blocks": [
    {
      "type": "table",
      "headers": [
        "Token",
        "Resolves To",
        "Status"
      ],
      "rows": [
        {
          "Token": "--zen-color-primary",
          "Resolves To": "--zen-color-royal-blue",
          "status_note": "Proposed",
          "status": "proposed"
        },
        {
          "Token": "--zen-color-success",
          "Resolves To": "--zen-color-green",
          "status_note": "Shipped",
          "status": "shipped"
        },
        {
          "Token": "--zen-color-warning",
          "Resolves To": "--zen-color-orange",
          "status_note": "Shipped",
          "status": "shipped"
        },
        {
          "Token": "--zen-color-error",
          "Resolves To": "--zen-color-red",
          "status_note": "Shipped",
          "status": "shipped"
        },
        {
          "Token": "--zen-color-neutral",
          "Resolves To": "--zen-color-cool-grey",
          "status_note": "Proposed",
          "status": "proposed"
        }
      ]
    }
  ]
}
