{
  "_schema_version": 1,
  "id": "color-primitives/primitives/pacific-blue",
  "title": "Pacific Blue",
  "path": [
    "color-primitives",
    "primitives",
    "pacific-blue"
  ],
  "parent": "color-primitives/primitives",
  "anchors": {
    "h2": "color-primitives",
    "h3": "primitives",
    "h4": "pacific-blue"
  },
  "source": {
    "file": "foundations/src/",
    "startLine": 326,
    "endLine": 343
  },
  "_meta": {
    "auto_generated": true,
    "source": "foundations/src/",
    "do_not_edit": "Edit the per-section src/ files; CI regenerates this file."
  },
  "body": "OKLCH 500 base: oklch(0.3803 0.1386 258.03)",
  "blocks": [
    {
      "type": "table",
      "headers": [
        "Shade",
        "Token",
        "Hex (Figma)",
        "OKLCH (Eng)"
      ],
      "rows": [
        {
          "Shade": "25",
          "Token": "--zen-color-pacific-blue-25",
          "Hex (Figma)": "`#F3F5F8` 🟡",
          "OKLCH (Eng)": "`oklch(0.97 0.005 258.03)` 🟡"
        },
        {
          "Shade": "50",
          "Token": "--zen-color-pacific-blue-50",
          "Hex (Figma)": "#CADCF7",
          "OKLCH (Eng)": "oklch(0.9134 0.0416 258.03)"
        },
        {
          "Shade": "100",
          "Token": "--zen-color-pacific-blue-100",
          "Hex (Figma)": "#A5BCDE",
          "OKLCH (Eng)": "oklch(0.8468 0.0554 258.03)"
        },
        {
          "Shade": "200",
          "Token": "--zen-color-pacific-blue-200",
          "Hex (Figma)": "#7A9CCD",
          "OKLCH (Eng)": "oklch(0.7469 0.0832 258.03)"
        },
        {
          "Shade": "300",
          "Token": "--zen-color-pacific-blue-300",
          "Hex (Figma)": "#577CB4",
          "OKLCH (Eng)": "oklch(0.6803 0.097 258.03)"
        },
        {
          "Shade": "400",
          "Token": "--zen-color-pacific-blue-400",
          "Hex (Figma)": "#315EA0",
          "OKLCH (Eng)": "oklch(0.5802 0.1178 258.03)"
        },
        {
          "Shade": "**500**",
          "Token": "**`--zen-color-pacific-blue-500`**",
          "Hex (Figma)": "**`#023E8A`**",
          "OKLCH (Eng)": "**`oklch(0.3803 0.1386 258.03)`**"
        },
        {
          "Shade": "600",
          "Token": "--zen-color-pacific-blue-600",
          "Hex (Figma)": "#003786",
          "OKLCH (Eng)": "oklch(0.3575 0.1455 258.03)"
        },
        {
          "Shade": "700",
          "Token": "--zen-color-pacific-blue-700",
          "Hex (Figma)": "#002F75",
          "OKLCH (Eng)": "oklch(0.3233 0.1317 258.03)"
        },
        {
          "Shade": "800",
          "Token": "--zen-color-pacific-blue-800",
          "Hex (Figma)": "#00255A",
          "OKLCH (Eng)": "oklch(0.2776 0.1040 258.03)"
        },
        {
          "Shade": "900",
          "Token": "--zen-color-pacific-blue-900",
          "Hex (Figma)": "#041E42",
          "OKLCH (Eng)": "oklch(0.2396 0.0762 258.03)"
        }
      ]
    }
  ]
}
