{
  "_schema_version": 1,
  "id": "color-primitives/primitives/yellow",
  "title": "Yellow",
  "path": [
    "color-primitives",
    "primitives",
    "yellow"
  ],
  "parent": "color-primitives/primitives",
  "anchors": {
    "h2": "color-primitives",
    "h3": "primitives",
    "h4": "yellow"
  },
  "source": {
    "file": "foundations/src/",
    "startLine": 290,
    "endLine": 307
  },
  "_meta": {
    "auto_generated": true,
    "source": "foundations/src/",
    "do_not_edit": "Edit the per-section src/ files; CI regenerates this file."
  },
  "body": "OKLCH 500 base: oklch(0.8699 0.1453 89.43)",
  "blocks": [
    {
      "type": "table",
      "headers": [
        "Shade",
        "Token",
        "Hex (Figma)",
        "OKLCH (Eng)"
      ],
      "rows": [
        {
          "Shade": "25",
          "Token": "--zen-color-yellow-25",
          "Hex (Figma)": "`#F6F5F1` 🟡",
          "OKLCH (Eng)": "`oklch(0.97 0.005 89.43)` 🟡"
        },
        {
          "Shade": "50",
          "Token": "--zen-color-yellow-50",
          "Hex (Figma)": "#FFF5D5",
          "OKLCH (Eng)": "oklch(0.9499 0.0436 89.43)"
        },
        {
          "Shade": "100",
          "Token": "--zen-color-yellow-100",
          "Hex (Figma)": "#FEEDC3",
          "OKLCH (Eng)": "oklch(0.9166 0.0581 89.43)"
        },
        {
          "Shade": "200",
          "Token": "--zen-color-yellow-200",
          "Hex (Figma)": "#FFE6A5",
          "OKLCH (Eng)": "oklch(0.8849 0.0872 89.43)"
        },
        {
          "Shade": "300",
          "Token": "--zen-color-yellow-300",
          "Hex (Figma)": "#FCDF91",
          "OKLCH (Eng)": "oklch(0.8533 0.1017 89.43)"
        },
        {
          "Shade": "400",
          "Token": "--zen-color-yellow-400",
          "Hex (Figma)": "#FBD776",
          "OKLCH (Eng)": "oklch(0.8616 0.1235 89.43)"
        },
        {
          "Shade": "**500**",
          "Token": "**`--zen-color-yellow-500`**",
          "Hex (Figma)": "**`#FACF55`**",
          "OKLCH (Eng)": "**`oklch(0.8699 0.1453 89.43)`**"
        },
        {
          "Shade": "600",
          "Token": "--zen-color-yellow-600",
          "Hex (Figma)": "#EABD34",
          "OKLCH (Eng)": "oklch(0.8177 0.1526 89.43)"
        },
        {
          "Shade": "700",
          "Token": "--zen-color-yellow-700",
          "Hex (Figma)": "#CDA52C",
          "OKLCH (Eng)": "oklch(0.7394 0.1381 89.43)"
        },
        {
          "Shade": "800",
          "Token": "--zen-color-yellow-800",
          "Hex (Figma)": "#A58732",
          "OKLCH (Eng)": "oklch(0.6351 0.1090 89.43)"
        },
        {
          "Shade": "900",
          "Token": "--zen-color-yellow-900",
          "Hex (Figma)": "#836F37",
          "OKLCH (Eng)": "oklch(0.5481 0.0799 89.43)"
        }
      ]
    }
  ]
}
