{
  "_schema_version": 1,
  "id": "tokens/breakpoints",
  "title": "Breakpoints",
  "path": [
    "tokens",
    "breakpoints"
  ],
  "parent": "tokens",
  "anchors": {
    "h2": "tokens",
    "h3": "breakpoints"
  },
  "source": {
    "file": "foundations/src/foundations.md",
    "startLine": 674,
    "endLine": 682
  },
  "_meta": {
    "auto_generated": true,
    "source": "foundations/src/foundations.md",
    "do_not_edit": "Edit the source MD; CI regenerates this file."
  },
  "blocks": [
    {
      "type": "table",
      "headers": [
        "Token",
        "Value",
        "Usage",
        "Status"
      ],
      "rows": [
        {
          "Token": "--zen-breakpoint-sm",
          "Value": "600px",
          "Usage": "Phone landscape",
          "status_note": "Shipped",
          "status": "shipped"
        },
        {
          "Token": "--zen-breakpoint-md",
          "Value": "840px",
          "Usage": "Tablet landscape",
          "status_note": "Shipped",
          "status": "shipped"
        },
        {
          "Token": "--zen-breakpoint-lg",
          "Value": "1200px",
          "Usage": "Desktop",
          "status_note": "Shipped",
          "status": "shipped"
        },
        {
          "Token": "--zen-breakpoint-xl",
          "Value": "1920px",
          "Usage": "Larger screens",
          "status_note": "Shipped",
          "status": "shipped"
        }
      ]
    }
  ]
}
